Name,Presenter,Location,Capacity of Workshop,Teaser,Description,Sessiontype,Capacity of Room,Picture URL,Notes,Presenter 1,Presenter 2,Presenter 3,Presenter 4
Your Peers are your greatest Role Models.,Patrick Au & Robele Baker    ,BUCH D304,30,You're only as good as the company you keep - so who is by your side? ,"This workshop will emphasize the saying ""You are only as good as the company you keep""ù and will educate you on strategies on how you can be successful based on the people you are surrounded by. We want delegates to feel empowered and to understand the power behind a strong group of friends and family. 

Delegates will be potentially asked about personal criteria while making friends and management of friends. In order to strive for success, we need a strong foundation - and it starts with the people we are with. ",Workshops 1,30,,,Patrick Au &,Robele Baker,,
Your Prismatic Identity,Shaina Dickson & Mason Margotta    ,BUCH D313,30,Explore your diversity and paint your identity!,Your identity is constantly changing to reflect the world around you. In this workshop you will learnt the meaning of identity salience and how different situations can bring out different aspects of your identity. Using this knowledge you will be able to better work within and lead diverse teams. You will also have the opportunity to utilize a unique form of painting to create a piece of art that reflects your personality.  ,Workshops 2,30,,,Shaina Dickson &,Mason Margotta,,
Graduate Students Workshops,,,150,Details will be coming soon!,,Workshops1,30,,,,,,
Graduate Students Workshops,,,150,Details will be coming soon!,,Workshops2,30,,,,,,
Cannot attend workshop,,,150,I can't be there!,,Workshops1,,,,,,,
Cannot attend workshop,,,150,I can't be there!,,Workshops2,,,,,,,
StrengthsFinder,,IBLC 261/185,150,,What are your top skills? The Centre for Student Involvement & Careers is sponsoring you to discover what makes you stand out with this popular assessment that provides strategies for applying your strengths. ,StrengthsFinder,112/40,,FIXED:This activity was split into two rooms,,,,
Freeflow,,IBLC Dodson Room/Lillooet Room,50,,"In an interactive session, imagine1day will introduce you to Creatribution, their unique model for charitable contribution. This session is a perfect fit for those delegates looking for a way to develop their personal leadership through making an impact for social good.  It's an opportunity to write your unwritten story by fulfilling your passions and great big dreams in a way that will have you inspired to move forward",Free Flow,60,,FIXED:This activity was split into two rooms,,,,
Gallery Walk,,IBLC 191,150,,"The gallery walk will be held in UBC's Morris and Helen Belkin Art Gallery; a fine arts gallery that exhibits art revolving around cultural studies. During a Gallery Walk, delegates would be able to explore multiple texts or images from The Spaces Between Contemporary Art From Havana by the world-renowned artists Antonio Eligio and Keith Wallace.","Eat First, Play Later",24,,IBLC 191 is used as the back-pack room,,,,
Laughter Yoga,,Abdul Ladha,125,,"If you're happy and you know it ... clap your hands! This is more than a children's song, its how every laughter yoga session begins! Did you know that the simple act of laughing could brighten your mood, decrease stress hormone production, and boost your immune system? Join John Wallstrom and Sadegh Aein in a combination of unconditional laughter exercises! ","Eat First, Play Later",125,,,,,,
Yoga,,Hillel House,200,,"Feeling tired after an exciting morning at the SLC? Get your yoga pants on and join us in a yoga practice that will energize your body, mind and soul. This activity will be facilitated by Vancouver's favorite yoga store! Register and you'll find out soon!  ","Eat First, Play Later",300,,,,,,
Improv,,HENN 202,150,,"UBC Improv is the University of British Columbia's home for improvisational comedy and improvisational theatre. Notably stationed in the Neville Scarfe 100 lecture hall, UBC Improv puts on shows once every two weeks from October to March during UBC's academic year. They are pleased to be performing at this year's Student Leadership Conference and hope you enjoy the SHOW! http://www.youtube.com/user/UBCimprov","Eat First, Play Later",150,,,,,,
Zumba,,Brock Hall Concourse,150,,Feeling like you need a dance party? Well come join one! Zumba is the hottest trend in fitness today. Come dance to a wide range of upbeat music and leave with a smile on your face! ,"Eat First, Play Later",150,,,,,,
Slam Poetry,,HENN 201,150,,"SLAM UBC whips words, sling syntax, pounds performances, and loves language. SLAM creates engaging activities and collaborates with you to help bring out the voice and personality within. ","Eat First, Play Later",155,,,,,,
Gallery Walk,,IBLC 191,150,,"The gallery walk will be held in UBC's Morris and Helen Belkin Art Gallery; a fine arts gallery that exhibits art revolving around cultural studies. During a Gallery Walk, delegates would be able to explore multiple texts or images from The Spaces Between Contemporary Art From Havana by the world-renowned artists Antonio Eligio and Keith Wallace.","Play First, Eat Later",24,,IBLC 191 is used as the back-pack room,,,,
Laughter Yoga,,Abdul Ladha,125,,"If you're happy and you know it ..clap your hands! This is more than a children's song, its how every laughter yoga session begins! Did you know that the simple act of laughing could brighten your mood, decrease stress hormone production, and boost your immune system? Join John Wallstrom and Sadegh Aein in a combination of unconditional laughter exercises! ","Play First, Eat Later",125,,,,,,
Yoga,,Hillel House,200,,"Feeling tired after an exciting morning at the SLC? Get your yoga pants on and join us in a yoga practice that will energize your body, mind and soul. This activity will be facilitated by Vancouver's favorite yoga store! Register and you'll find out soon!  ","Play First, Eat Later",300,,,,,,
Improv,,HENN 202,150,,"UBC Improv is the University of British Columbia's home for improvisational comedy and improvisational theatre. Notably stationed in the Neville Scarfe 100 lecture hall, UBC Improv puts on shows once every two weeks from October to March during UBC's academic year. They are pleased to be performing at this year's Student Leadership Conference and hope you enjoy the SHOW! http://www.youtube.com/user/UBCimprov","Play First, Eat Later",150,,,,,,
Zumba,,Brock Hall Concourse,150,,Feeling like you need a dance party? Well come join one! Zumba is the hottest trend in fitness today. Come dance to a wide range of upbeat music and leave with a smile on your face! ,"Play First, Eat Later",150,,,,,,
Slam Poetry,,HENN 201,150,,"SLAM UBC whips words, sling syntax, pounds performances, and loves language. SLAM creates engaging activities and collaborates with you to help bring out the voice and personality within. ","Play First, Eat Later",155,,,,,,
